      -----------------------------------------------------------      
     |                   =====================                   |     
     |                           x T B                           |     
     |                   =====================                   |     
     |                         S. Grimme                         |     
     |          Mulliken Center for Theoretical Chemistry        |     
     |                    University of Bonn                     |     
      -----------------------------------------------------------      

   * xtb version 6.3.3 (4ae9cef) compiled by 'conda@95abc7406d43' on 2020-10-14

   xtb is free software: you can redistribute it and/or modify it under
   the terms of the GNU Lesser General Public License as published by
   the Free Software Foundation, either version 3 of the License, or
   (at your option) any later version.
   
   xtb is distributed in the hope that it will be useful,
   but WITHOUT ANY WARRANTY; without even the implied warranty of
   MERCHANTABILITY or FITNESS FOR A PARTICULAR PURPOSE.  See the
   GNU Lesser General Public License for more details.
   
   Cite this work as:
   * C. Bannwarth, E. Caldeweyher, S. Ehlert, A. Hansen, P. Pracht,
     J. Seibert, S. Spicher, S. Grimme, WIREs Comput. Mol. Sci., 2020,
     e01493. DOI: 10.1002/wcms.1493
   
   for GFN2-xTB:
   * S. Grimme, C. Bannwarth, P. Shushkov, J. Chem. Theory Comput., 2017,
     13, 1989-2009. DOI: 10.1021/acs.jctc.7b00118
   for GFN1-xTB:
   * C. Bannwarth, S. Ehlert and S. Grimme., J. Chem. Theory Comput., 2019,
     15, 1652-1671. DOI: 10.1021/acs.jctc.8b01176
   for GFN0-xTB:
   * P. Pracht, E. Caldeweyher, S. Ehlert, S. Grimme, ChemRxiv, 2019, preprint.
     DOI: 10.26434/chemrxiv.8326202.v1
   for GFN-FF:
   * S. Spicher and S. Grimme, Angew. Chem. Int. Ed., 2020, 59, 15665-15673.
     DOI: 10.1002/anie.202004239
   
   for DFT-D4:
   * E. Caldeweyher, C. Bannwarth and S. Grimme, J. Chem. Phys., 2017,
     147, 034112. DOI: 10.1063/1.4993215
   * E. Caldeweyher, S. Ehlert, A. Hansen, H. Neugebauer, S. Spicher,
     C. Bannwarth and S. Grimme, J. Chem. Phys., 2019, 150, 154122.
     DOI: 10.1063/1.5090222
   * E. Caldeweyher, J.-M. Mewes, S. Ehlert and S. Grimme, Phys. Chem. Chem. Phys.
     2020, 22, 8499-8512. DOI: 10.1039/D0CP00502A
   
   for sTDA-xTB:
   * S. Grimme and C. Bannwarth, J. Chem. Phys., 2016, 145, 054103.
     DOI: 10.1063/1.4959605
   
   in the mass-spec context:
   * V. Asgeirsson, C. Bauer and S. Grimme, Chem. Sci., 2017, 8, 4879.
     DOI: 10.1039/c7sc00601b
   * J. Koopman and S. Grimme, ACS Omega 2019, 4, 12, 15120-15133.
     DOI: 10.1021/acsomega.9b02011
   
   for metadynamics refer to:
   * S. Grimme, J. Chem. Theory Comput., 2019, 155, 2847-2862
     DOI: 10.1021/acs.jctc.9b00143
   
   with help from (in alphabetical order)
   C. Bannwarth, F. Bohle, G. Brandenburg, E. Caldeweyher, M. Checinski,
   S. Dohm, S. Ehlert, S. Ehrlich, F. März, H. Neugebauer, J. Pisarek,
   P. Pracht, P. Shushkov, and S. Spicher.
   
 * started run on 2022/03/17 at 02:19:23.402     

           -------------------------------------------------
          |                Calculation Setup                |
           -------------------------------------------------

          program call               : xtb alk_13.xyz --opt --chrg 0 --uhf 0 --gfn 2
          coordinate file            : alk_13.xyz
          omp threads                :                    64
          number of atoms            :                    29
          number of electrons        :                    74
          charge                     :                     0
          spin                       :                   0.0
          first test random number   :      0.23181475303338

   ID    Z sym.   atoms
    1    6 C      1-15
    2    1 H      16-29

           -------------------------------------------------
          |                 G F N 2 - x T B                 |
           -------------------------------------------------

        Reference                      10.1021/acs.jctc.8b01176
      * Hamiltonian:
        H0-scaling (s, p, d)           1.850000    2.230000    2.230000
        zeta-weighting                 0.500000
      * Dispersion:
        s8                             2.700000
        a1                             0.520000
        a2                             5.000000
        s9                             5.000000
      * Repulsion:
        kExp                           1.500000    1.000000
        rExp                           1.000000
      * Coulomb:
        alpha                          2.000000
        third order                    shell-resolved
        anisotropic                    true
        a3                             3.000000
        a5                             4.000000
        cn-shift                       1.200000
        cn-exp                         4.000000
        max-rad                        5.000000


          ...................................................
          :                      SETUP                      :
          :.................................................:
          :  # basis functions                  74          :
          :  # atomic orbitals                  74          :
          :  # shells                           44          :
          :  # electrons                        74          :
          :  max. iterations                   250          :
          :  Hamiltonian                  GFN2-xTB          :
          :  restarted?                      false          :
          :  GBSA solvation                  false          :
          :  PC potential                    false          :
          :  electronic temp.          300.0000000     K    :
          :  accuracy                    1.0000000          :
          :  -> integral cutoff          0.2500000E+02      :
          :  -> integral neglect         0.1000000E-07      :
          :  -> SCF convergence          0.1000000E-05 Eh   :
          :  -> wf. convergence          0.1000000E-03 e    :
          :  Broyden damping             0.4000000          :
          ...................................................

 iter      E             dE          RMSdq      gap      omega  full diag
   1    -39.8838603 -0.398839E+02  0.426E+00    3.87       0.0  T
   2    -39.9132341 -0.293738E-01  0.254E+00    3.85       1.0  T
   3    -39.8957295  0.175046E-01  0.987E-01    3.81       1.0  T
   4    -39.9140652 -0.183357E-01  0.400E-01    3.84       1.0  T
   5    -39.9174828 -0.341767E-02  0.659E-02    3.84       1.0  T
   6    -39.9175592 -0.763255E-04  0.359E-02    3.84       1.0  T
   7    -39.9175685 -0.931982E-05  0.115E-02    3.84       1.6  T
   8    -39.9175694 -0.879661E-06  0.418E-03    3.84       4.4  T
   9    -39.9175698 -0.477915E-06  0.800E-04    3.84      23.2  T
  10    -39.9175698 -0.749288E-08  0.412E-04    3.84      45.0  T

   *** convergence criteria satisfied after 10 iterations ***

         #    Occupation            Energy/Eh            Energy/eV
      -------------------------------------------------------------
         1        2.0000           -0.6416711             -17.4608
       ...           ...                  ...                  ...
        31        2.0000           -0.4193212             -11.4103
        32        2.0000           -0.4150384             -11.2938
        33        2.0000           -0.4023223             -10.9477
        34        2.0000           -0.3997507             -10.8778
        35        2.0000           -0.3987955             -10.8518
        36        2.0000           -0.3968727             -10.7995
        37        2.0000           -0.3806590             -10.3583 (HOMO)
        38                         -0.2396375              -6.5209 (LUMO)
        39                         -0.2238157              -6.0903
        40                         -0.2226801              -6.0594
        41                         -0.2096925              -5.7060
        42                         -0.1996898              -5.4338
       ...                                ...                  ...
        74                          0.6572346              17.8843
      -------------------------------------------------------------
                  HL-Gap            0.1410215 Eh            3.8374 eV
             Fermi-level           -0.3101482 Eh           -8.4396 eV

 SCC (total)                   0 d,  0 h,  0 min,  0.246 sec
 SCC setup                      ...        0 min,  0.020 sec (  8.068%)
 Dispersion                     ...        0 min,  0.017 sec (  6.881%)
 classical contributions        ...        0 min,  0.011 sec (  4.550%)
 integral evaluation            ...        0 min,  0.030 sec ( 12.368%)
 iterations                     ...        0 min,  0.021 sec (  8.407%)
 molecular gradient             ...        0 min,  0.147 sec ( 59.601%)
 printout                       ...        0 min,  0.000 sec (  0.098%)

         :::::::::::::::::::::::::::::::::::::::::::::::::::::
         ::                     SUMMARY                     ::
         :::::::::::::::::::::::::::::::::::::::::::::::::::::
         :: total energy             -39.203744997351 Eh    ::
         :: gradient norm              0.048451246170 Eh/a0 ::
         :: HOMO-LUMO gap              3.837391446980 eV    ::
         ::.................................................::
         :: SCC energy               -39.917569849435 Eh    ::
         :: -> isotropic ES            0.002622124963 Eh    ::
         :: -> anisotropic ES          0.006097541586 Eh    ::
         :: -> anisotropic XC          0.029380789624 Eh    ::
         :: -> dispersion             -0.027649459335 Eh    ::
         :: repulsion energy           0.713922497173 Eh    ::
         :: add. restraining           0.000000000000 Eh    ::
         :: total charge               0.000000000000 e     ::
         :::::::::::::::::::::::::::::::::::::::::::::::::::::

      ----------------------------------------------------------- 
     |                   =====================                   |
     |                        A N C O P T                        |
     |                   =====================                   |
     |               Approximate Normal Coordinate               |
     |                Rational Function Optimizer                |
      ----------------------------------------------------------- 

          ...................................................
          :                      SETUP                      :
          :.................................................:
          :   optimization level            normal          :
          :   max. optcycles                   200          :
          :   ANC micro-cycles                  20          :
          :   degrees of freedom                81          :
          :.................................................:
          :   RF solver                   davidson          :
          :   write xtbopt.log                true          :
          :   linear?                        false          :
          :   energy convergence         0.5000000E-05 Eh   :
          :   grad. convergence          0.1000000E-02 Eh/α :
          :   maximium RF displ.         1.0000000          :
          :   Hlow (freq-cutoff)         0.1000000E-01      :
          :   Hmax (freq-cutoff)         5.0000000          :
          :   S6 in model hess.         20.0000000          :
          ...................................................

generating ANC from model Hessian ...
Using Lindh-Hessian (1995)
 Shifting diagonal of input Hessian by    9.4818509279851523E-003
 Lowest  eigenvalues of input Hessian
    0.000000    0.000000    0.000000    0.000000    0.000000    0.000000
    0.010000    0.010534    0.011140    0.012164    0.012365    0.013284
    0.017736    0.021546    0.022833    0.023316    0.023880    0.026612
 Highest eigenvalues
    1.830658    1.856987    1.891303    1.906530    1.936688    2.005456


........................................................................
.............................. CYCLE    1 ..............................
........................................................................
   1    -39.9175699 -0.399176E+02  0.141E-04    3.84       0.0  T
   2    -39.9175699 -0.626699E-10  0.892E-05    3.84     208.1  T
   3    -39.9175699 -0.435492E-10  0.570E-05    3.84     325.6  T
     SCC iter.                  ...        0 min,  0.011 sec
     gradient                   ...        0 min,  0.123 sec
 * total energy  :   -39.2037450 Eh     change       -0.1054730E-08 Eh
   gradient norm :     0.0484512 Eh/α   predicted     0.0000000E+00 (-100.00%)
   displ. norm   :     0.2115564 α      lambda       -0.5305917E-02
   maximum displ.:     0.1007569 α      in ANC's #12, #44, #14, ...

........................................................................
.............................. CYCLE    2 ..............................
........................................................................
   1    -39.9602732 -0.399603E+02  0.135E-01    3.90       0.0  T
   2    -39.9602766 -0.337624E-05  0.802E-02    3.90       1.0  T
   3    -39.9602650  0.115833E-04  0.234E-02    3.91       1.0  T
   4    -39.9602781 -0.131130E-04  0.368E-03    3.91       5.0  T
   5    -39.9602783 -0.212940E-06  0.202E-03    3.91       9.2  T
   6    -39.9602784 -0.228238E-07  0.711E-04    3.91      26.1  T
   7    -39.9602784 -0.446997E-08  0.208E-04    3.91      89.3  T
     SCC iter.                  ...        0 min,  0.012 sec
     gradient                   ...        0 min,  0.140 sec
 * total energy  :   -39.2070458 Eh     change       -0.3300767E-02 Eh
   gradient norm :     0.0118674 Eh/α   predicted    -0.2771707E-02 ( -16.03%)
   displ. norm   :     0.1627064 α      lambda       -0.7233429E-03
   maximum displ.:     0.0754935 α      in ANC's #12, #5, #6, ...

........................................................................
.............................. CYCLE    3 ..............................
........................................................................
   1    -39.9740540 -0.399741E+02  0.730E-02    3.91       0.0  T
   2    -39.9740549 -0.899881E-06  0.433E-02    3.92       1.0  T
   3    -39.9740528  0.211480E-05  0.100E-02    3.91       1.9  T
   4    -39.9740552 -0.243833E-05  0.183E-03    3.92      10.2  T
   5    -39.9740553 -0.608856E-07  0.867E-04    3.92      21.4  T
   6    -39.9740553 -0.305889E-08  0.375E-04    3.92      49.5  T
     SCC iter.                  ...        0 min,  0.014 sec
     gradient                   ...        0 min,  0.130 sec
 * total energy  :   -39.2074720 Eh     change       -0.4262139E-03 Eh
   gradient norm :     0.0039013 Eh/α   predicted    -0.3712546E-03 ( -12.89%)
   displ. norm   :     0.1371671 α      lambda       -0.2273487E-03
   maximum displ.:     0.0600935 α      in ANC's #6, #3, #5, ...

........................................................................
.............................. CYCLE    4 ..............................
........................................................................
   1    -39.9765112 -0.399765E+02  0.618E-02    3.90       0.0  T
   2    -39.9765115 -0.292216E-06  0.365E-02    3.90       1.0  T
   3    -39.9765103  0.112313E-05  0.688E-03    3.90       2.7  T
   4    -39.9765116 -0.129469E-05  0.103E-03    3.90      18.0  T
   5    -39.9765116 -0.140730E-07  0.572E-04    3.90      32.5  T
   6    -39.9765116 -0.194718E-08  0.213E-04    3.90      87.0  T
     SCC iter.                  ...        0 min,  0.013 sec
     gradient                   ...        0 min,  0.138 sec
 * total energy  :   -39.2076077 Eh     change       -0.1357529E-03 Eh
   gradient norm :     0.0040163 Eh/α   predicted    -0.1158189E-03 ( -14.68%)
   displ. norm   :     0.1370159 α      lambda        0.9396582E-04
   maximum displ.:     0.0601005 α      in ANC's #6, #3, #5, ...

........................................................................
.............................. CYCLE    5 ..............................
........................................................................
   1    -39.9785181 -0.399785E+02  0.620E-02    3.88       0.0  T
   2    -39.9785184 -0.310618E-06  0.365E-02    3.88       1.0  T
   3    -39.9785168  0.153625E-05  0.805E-03    3.88       2.3  T
   4    -39.9785186 -0.174477E-05  0.108E-03    3.88      17.3  T
   5    -39.9785186 -0.158995E-07  0.569E-04    3.88      32.7  T
   6    -39.9785186 -0.173775E-08  0.222E-04    3.88      83.7  T
     SCC iter.                  ...        0 min,  0.010 sec
     gradient                   ...        0 min,  0.134 sec
 * total energy  :   -39.2075591 Eh     change        0.4864046E-04 Eh
   gradient norm :     0.0076178 Eh/α   predicted     0.4786156E-04 (  -1.60%)
   displ. norm   :     0.0700687 α      lambda       -0.2672577E-03
   maximum displ.:     0.0308753 α      in ANC's #3, #19, #5, ...

........................................................................
.............................. CYCLE    6 ..............................
........................................................................
   1    -39.9751967 -0.399752E+02  0.526E-02    3.87       0.0  T
   2    -39.9751969 -0.208702E-06  0.315E-02    3.87       1.0  T
   3    -39.9751967  0.235406E-06  0.367E-03    3.87       5.1  T
   4    -39.9751970 -0.337459E-06  0.927E-04    3.87      20.0  T
   5    -39.9751970 -0.207764E-08  0.544E-04    3.87      34.1  T
     SCC iter.                  ...        0 min,  0.012 sec
     gradient                   ...        0 min,  0.127 sec
 * total energy  :   -39.2077178 Eh     change       -0.1586828E-03 Eh
   gradient norm :     0.0030855 Eh/α   predicted    -0.1342912E-03 ( -15.37%)
   displ. norm   :     0.0898774 α      lambda       -0.7943525E-04
   maximum displ.:     0.0502578 α      in ANC's #3, #4, #5, ...

........................................................................
.............................. CYCLE    7 ..............................
........................................................................
   1    -39.9730139 -0.399730E+02  0.441E-02    3.86       0.0  T
   2    -39.9730140 -0.100462E-06  0.260E-02    3.86       1.0  T
   3    -39.9730135  0.526611E-06  0.386E-03    3.86       4.8  T
   4    -39.9730141 -0.607726E-06  0.528E-04    3.86      35.1  T
   5    -39.9730141 -0.206329E-08  0.301E-04    3.86      61.7  T
     SCC iter.                  ...        0 min,  0.010 sec
     gradient                   ...        0 min,  0.135 sec
 * total energy  :   -39.2077819 Eh     change       -0.6409045E-04 Eh
   gradient norm :     0.0016129 Eh/α   predicted    -0.4003877E-04 ( -37.53%)
   displ. norm   :     0.3325276 α      lambda       -0.1268188E-03
   maximum displ.:     0.1793648 α      in ANC's #3, #4, #5, ...

........................................................................
.............................. CYCLE    8 ..............................
........................................................................
   1    -39.9694867 -0.399695E+02  0.155E-01    3.81       0.0  T
   2    -39.9694876 -0.906850E-06  0.912E-02    3.81       1.0  T
   3    -39.9694825  0.509986E-05  0.122E-02    3.81       1.5  T
   4    -39.9694884 -0.589558E-05  0.161E-03    3.81      11.5  T
   5    -39.9694884 -0.126007E-07  0.980E-04    3.81      18.9  T
   6    -39.9694884 -0.776092E-08  0.304E-04    3.81      61.1  T
     SCC iter.                  ...        0 min,  0.012 sec
     gradient                   ...        0 min,  0.136 sec
 * total energy  :   -39.2078973 Eh     change       -0.1154019E-03 Eh
   gradient norm :     0.0039770 Eh/α   predicted    -0.6653394E-04 ( -42.35%)
   displ. norm   :     0.1288596 α      lambda       -0.6233141E-04
   maximum displ.:     0.0708457 α      in ANC's #4, #3, #5, ...

........................................................................
.............................. CYCLE    9 ..............................
........................................................................
   1    -39.9707751 -0.399708E+02  0.581E-02    3.80       0.0  T
   2    -39.9707752 -0.105536E-06  0.341E-02    3.80       1.0  T
   3    -39.9707747  0.580660E-06  0.467E-03    3.80       4.0  T
   4    -39.9707753 -0.675739E-06  0.557E-04    3.80      33.3  T
   5    -39.9707753 -0.154291E-08  0.342E-04    3.80      54.3  T
     SCC iter.                  ...        0 min,  0.013 sec
     gradient                   ...        0 min,  0.126 sec
 * total energy  :   -39.2079509 Eh     change       -0.5362897E-04 Eh
   gradient norm :     0.0030170 Eh/α   predicted    -0.3168530E-04 ( -40.92%)
   displ. norm   :     0.2205097 α      lambda       -0.1026865E-03
   maximum displ.:     0.1282378 α      in ANC's #4, #3, #1, ...

........................................................................
.............................. CYCLE   10 ..............................
........................................................................
   1    -39.9734464 -0.399734E+02  0.999E-02    3.78       0.0  T
   2    -39.9734466 -0.293337E-06  0.586E-02    3.78       1.0  T
   3    -39.9734456  0.105746E-05  0.644E-03    3.78       2.9  T
   4    -39.9734469 -0.128159E-05  0.898E-04    3.78      20.7  T
   5    -39.9734469 -0.376044E-08  0.551E-04    3.78      33.7  T
   6    -39.9734469 -0.205185E-08  0.109E-04    3.78     170.0  T
     SCC iter.                  ...        0 min,  0.010 sec
     gradient                   ...        0 min,  0.142 sec
 * total energy  :   -39.2080241 Eh     change       -0.7318578E-04 Eh
   gradient norm :     0.0012936 Eh/α   predicted    -0.5384042E-04 ( -26.43%)
   displ. norm   :     0.2671057 α      lambda       -0.4447057E-04
   maximum displ.:     0.1612220 α      in ANC's #4, #3, #1, ...

........................................................................
.............................. CYCLE   11 ..............................
........................................................................
   1    -39.9743272 -0.399743E+02  0.121E-01    3.75       0.0  T
   2    -39.9743277 -0.421573E-06  0.712E-02    3.75       1.0  T
   3    -39.9743272  0.444813E-06  0.439E-03    3.75       4.2  T
   4    -39.9743279 -0.694226E-06  0.102E-03    3.75      18.2  T
   5    -39.9743279 -0.826063E-09  0.601E-04    3.75      30.9  T
   6    -39.9743279 -0.435546E-08  0.144E-04    3.75     128.7  T
     SCC iter.                  ...        0 min,  0.010 sec
     gradient                   ...        0 min,  0.123 sec
 * total energy  :   -39.2080634 Eh     change       -0.3935339E-04 Eh
   gradient norm :     0.0017584 Eh/α   predicted    -0.2294605E-04 ( -41.69%)
   displ. norm   :     0.0864684 α      lambda       -0.1514914E-04
   maximum displ.:     0.0493744 α      in ANC's #4, #6, #3, ...

........................................................................
.............................. CYCLE   12 ..............................
........................................................................
   1    -39.9744694 -0.399745E+02  0.398E-02    3.75       0.0  T
   2    -39.9744695 -0.689464E-07  0.234E-02    3.75       1.0  T
   3    -39.9744690  0.492684E-06  0.449E-03    3.75       4.1  T
   4    -39.9744695 -0.561142E-06  0.431E-04    3.75      43.0  T
   5    -39.9744695 -0.186486E-08  0.254E-04    3.75      73.0  T
     SCC iter.                  ...        0 min,  0.012 sec
     gradient                   ...        0 min,  0.140 sec
 * total energy  :   -39.2080798 Eh     change       -0.1635270E-04 Eh
   gradient norm :     0.0009526 Eh/α   predicted    -0.7600393E-05 ( -53.52%)
   displ. norm   :     0.0891551 α      lambda       -0.1040301E-04
   maximum displ.:     0.0504798 α      in ANC's #4, #3, #6, ...

........................................................................
.............................. CYCLE   13 ..............................
........................................................................
   1    -39.9732991 -0.399733E+02  0.412E-02    3.74       0.0  T
   2    -39.9732992 -0.760433E-07  0.242E-02    3.74       1.0  T
   3    -39.9732987  0.506301E-06  0.446E-03    3.74       4.2  T
   4    -39.9732993 -0.580867E-06  0.443E-04    3.74      41.9  T
   5    -39.9732993 -0.266297E-09  0.292E-04    3.74      63.5  T
     SCC iter.                  ...        0 min,  0.008 sec
     gradient                   ...        0 min,  0.119 sec
 * total energy  :   -39.2080879 Eh     change       -0.8111167E-05 Eh
   gradient norm :     0.0005179 Eh/α   predicted    -0.5221265E-05 ( -35.63%)
   displ. norm   :     0.0243888 α      lambda       -0.2341980E-05
   maximum displ.:     0.0192246 α      in ANC's #6, #5, #4, ...

........................................................................
.............................. CYCLE   14 ..............................
........................................................................
   1    -39.9736332 -0.399736E+02  0.121E-02    3.74       0.0  T
   2    -39.9736332 -0.535129E-08  0.715E-03    3.74       2.6  T
   3    -39.9736332  0.144645E-07  0.793E-04    3.74      23.4  T
   4    -39.9736332 -0.179480E-07  0.138E-04    3.74     134.3  T
     SCC iter.                  ...        0 min,  0.006 sec
     gradient                   ...        0 min,  0.125 sec
 * total energy  :   -39.2080902 Eh     change       -0.2326247E-05 Eh
   gradient norm :     0.0002883 Eh/α   predicted    -0.1173831E-05 ( -49.54%)
   displ. norm   :     0.0165121 α      lambda       -0.8633351E-06
   maximum displ.:     0.0115604 α      in ANC's #6, #4, #2, ...

   *** GEOMETRY OPTIMIZATION CONVERGED AFTER 14 ITERATIONS ***

------------------------------------------------------------------------
 total energy gain   :        -0.0043452 Eh       -2.7267 kcal/mol
 total RMSD          :         0.2875138 a0        0.1521 Å
 total power (kW/mol):        -0.8148853 (step)   -3.4444 (real)
------------------------------------------------------------------------

 ANCopt (total)                0 d,  0 h,  0 min,  3.312 sec
 optimizer setup                ...        0 min,  0.000 sec (  0.003%)
 model hessian                  ...        0 min,  0.005 sec (  0.146%)
 ANC generation                 ...        0 min,  0.001 sec (  0.044%)
 coordinate transformation      ...        0 min,  0.000 sec (  0.006%)
 single point calculation       ...        0 min,  3.100 sec ( 93.605%)
 optimization log               ...        0 min,  0.001 sec (  0.034%)
 hessian update                 ...        0 min,  0.201 sec (  6.064%)
 rational function              ...        0 min,  0.001 sec (  0.037%)

================
 final structure:
================
29
 xtb: 6.3.3 (4ae9cef)
C        -4.99354278110871    0.02977059482903   -1.40081656106262
C        -4.20559999384430   -0.39821149371019   -0.43329510051910
C        -3.54708158013184    0.48907339166254    0.58133002929558
C        -2.05113182102975    0.34858488253268    0.48331962280070
C        -1.33493454500697   -0.40079562310116    1.40641936225205
C         0.03514813182566   -0.54272220452501    1.29210870041969
C         0.72701634722991    0.05413057315753    0.24191337054679
C         2.18488689166707   -0.09405567581500    0.12024382963438
C         2.77600608112405   -0.31960771758506   -1.12078066286524
C         4.14678685363644   -0.45927527280703   -1.23306512628787
C         4.95047545338705   -0.37127968751163   -0.10885302520246
C         4.37407285745903   -0.14544925258032    1.12977724684889
C         3.00306342233824   -0.01035753636594    1.24453151039403
C         0.00464576082165    0.79721498578334   -0.68941912228029
C        -1.36297531730647    0.94226699992940   -0.56798693108723
H        -5.23477776636034    1.07424538389927   -1.51653397343663
H        -5.43910926597347   -0.64254654580788   -2.11427358487907
H        -3.97400783959271   -1.45131781675502   -0.33816134915125
H        -3.87658209572203    0.19753132118707    1.58225305930220
H        -3.83953847312124    1.52656993943514    0.40637175017460
H        -1.85400565586753   -0.87744804210729    2.22646562176081
H         0.57352328510367   -1.13994692867325    2.01382856496160
H         2.15238737981403   -0.40539290118309   -1.99892550717365
H         4.59079000684552   -0.63938607739288   -2.20155285692206
H         6.02166623659410   -0.47821212577555   -0.19761680145715
H         4.99655170613514   -0.07219425545651    2.00995106312263
H         2.56032262118316    0.18243578128808    2.21106066741296
H         0.52524226377277    1.28182439294777   -1.50268699864980
H        -1.90929916387144    1.52454891050140   -1.29637279795239

 Bond Distances (Angstroems)
 ---------------------------
C1-C2=1.3191         C1-H16=1.0782        C1-H17=1.0768        C2-C1=1.3191         C2-C3=1.5001         C2-H18=1.0825        
C3-C2=1.5001         C3-C4=1.5057         C3-H19=1.0934        C3-H20=1.0920        C4-C3=1.5057         C4-C5=1.3880         
C4-C15=1.3897        C5-C4=1.3880         C5-C6=1.3821         C5-H21=1.0813        C6-C5=1.3821         C6-C7=1.3921         
C6-H22=1.0805        C7-C6=1.3921         C7-C8=1.4704         C7-C14=1.3933        C8-C7=1.4704         C8-C9=1.3930         
C8-C13=1.3930        C9-C8=1.3930         C9-C10=1.3824        C9-H23=1.0805        C10-C9=1.3824        C10-C11=1.3847       
C10-H24=1.0805       C11-C10=1.3847       C11-C12=1.3847       C11-H25=1.0802       C12-C11=1.3847       C12-C13=1.3824       
C12-H26=1.0805       C13-C8=1.3930        C13-C12=1.3824       C13-H27=1.0804       C14-C7=1.3933        C14-C15=1.3806       
C14-H28=1.0804       C15-C4=1.3897        C15-C14=1.3806       C15-H29=1.0808       H16-C1=1.0782        H17-C1=1.0768        
H18-C2=1.0825        H19-C3=1.0934        H20-C3=1.0920        H21-C5=1.0813        H22-C6=1.0805        H23-C9=1.0805        
H24-C10=1.0805       H25-C11=1.0802       H26-C12=1.0805       H27-C13=1.0804       H28-C14=1.0804       H29-C15=1.0808       
 C  H  Rav=1.0820 sigma=0.0046  Rmin=1.0768  Rmax=1.0934    14
 C  C  Rav=1.4026 sigma=0.0467  Rmin=1.3191  Rmax=1.5057    16

 selected bond angles (degree)
 --------------------
H16-C1-C2=121.78               H17-C1-C2=122.04               H17-C1-H16=116.18              C3-C2-C1=124.50                
H18-C2-C1=120.52               H18-C2-C3=114.97               C4-C3-C2=109.69                H19-C3-C2=109.22               
H19-C3-C4=109.52               H20-C3-C2=109.63               H20-C3-C4=110.14               H20-C3-H19=108.62              
C5-C4-C3=121.31                C15-C4-C3=120.09               C15-C4-C5=118.57               C6-C5-C4=120.79                
H21-C5-C4=119.65               H21-C5-C6=119.56               C7-C6-C5=120.73                H22-C6-C5=119.70               
H22-C6-C7=119.56               C8-C7-C6=120.80                C14-C7-C6=118.38               C14-C7-C8=120.83               
C9-C8-C7=120.71                C13-C8-C7=120.63               C13-C8-C9=118.65               C10-C9-C8=120.63               
H23-C9-C8=119.47               H23-C9-C10=119.89              C11-C10-C9=120.21              H24-C10-C9=119.81              
H24-C10-C11=119.99             

 selected dihedral angles (degree)
 ---------------------------------
C3-C2-C1-H16=358.90           C3-C2-C1-H17=179.43           H18-C2-C1-H16=180.22          H18-C2-C1-H17=  0.76          
C4-C3-C2-C1=240.24            C4-C3-C2-H18= 58.98           H19-C3-C2-C1=120.20           H19-C3-C2-H18=298.95          
H20-C3-C2-C1=  1.30           H20-C3-C2-H18=180.04          C5-C4-C3-C2=256.93            C5-C4-C3-H19= 16.78           
C5-C4-C3-H20=136.18           C15-C4-C3-C2= 75.02           C15-C4-C3-H19=194.88          C15-C4-C3-H20=314.27          
C6-C5-C4-C3=178.80            C6-C5-C4-C15=  0.68           H21-C5-C4-C3=358.64           H21-C5-C4-C15=180.52          
C7-C6-C5-C4=359.48            C7-C6-C5-H21=179.64           H22-C6-C5-C4=180.74           H22-C6-C5-H21=  0.90          
C8-C7-C6-C5=179.90            C8-C7-C6-H22=358.64           C14-C7-C6-C5=  0.00           C14-C7-C6-H22=178.76          
C9-C8-C7-C6=138.38            C9-C8-C7-C14=318.26           C13-C8-C7-C6=318.32           C13-C8-C7-C14=138.20          
C10-C9-C8-C7=180.03           C10-C9-C8-C13=  0.09          H23-C9-C8-C7=358.80           H23-C9-C8-C13=178.86          
C11-C10-C9-C8=359.77          C11-C10-C9-H23=181.01         H24-C10-C9-C8=179.66          H24-C10-C9-H23=  0.90         
           -------------------------------------------------
          |                Final Singlepoint                |
           -------------------------------------------------

          ...................................................
          :                      SETUP                      :
          :.................................................:
          :  # basis functions                  74          :
          :  # atomic orbitals                  74          :
          :  # shells                           44          :
          :  # electrons                        74          :
          :  max. iterations                   250          :
          :  Hamiltonian                  GFN2-xTB          :
          :  restarted?                      false          :
          :  GBSA solvation                  false          :
          :  PC potential                    false          :
          :  electronic temp.          300.0000000     K    :
          :  accuracy                    1.0000000          :
          :  -> integral cutoff          0.2500000E+02      :
          :  -> integral neglect         0.1000000E-07      :
          :  -> SCF convergence          0.1000000E-05 Eh   :
          :  -> wf. convergence          0.1000000E-03 e    :
          :  Broyden damping             0.4000000          :
          ...................................................

 iter      E             dE          RMSdq      gap      omega  full diag
   1    -39.9736332 -0.399736E+02  0.796E-05    3.74       0.0  T
   2    -39.9736332 -0.270788E-10  0.533E-05    3.74     348.5  T
   3    -39.9736332 -0.249543E-10  0.310E-05    3.74     598.4  T

   *** convergence criteria satisfied after 3 iterations ***

         #    Occupation            Energy/Eh            Energy/eV
      -------------------------------------------------------------
         1        2.0000           -0.6449785             -17.5508
       ...           ...                  ...                  ...
        31        2.0000           -0.4175305             -11.3616
        32        2.0000           -0.4151040             -11.2956
        33        2.0000           -0.4059403             -11.0462
        34        2.0000           -0.4020882             -10.9414
        35        2.0000           -0.4014793             -10.9248
        36        2.0000           -0.3993567             -10.8670
        37        2.0000           -0.3791368             -10.3168 (HOMO)
        38                         -0.2417405              -6.5781 (LUMO)
        39                         -0.2196274              -5.9764
        40                         -0.2192709              -5.9667
        41                         -0.2040704              -5.5530
        42                         -0.1915375              -5.2120
       ...                                ...                  ...
        74                          0.6935140              18.8715
      -------------------------------------------------------------
                  HL-Gap            0.1373964 Eh            3.7387 eV
             Fermi-level           -0.3104386 Eh           -8.4475 eV

 SCC (total)                   0 d,  0 h,  0 min,  0.238 sec
 SCC setup                      ...        0 min,  0.015 sec (  6.158%)
 Dispersion                     ...        0 min,  0.016 sec (  6.763%)
 classical contributions        ...        0 min,  0.020 sec (  8.405%)
 integral evaluation            ...        0 min,  0.032 sec ( 13.609%)
 iterations                     ...        0 min,  0.009 sec (  3.819%)
 molecular gradient             ...        0 min,  0.145 sec ( 61.112%)
 printout                       ...        0 min,  0.000 sec (  0.102%)

         :::::::::::::::::::::::::::::::::::::::::::::::::::::
         ::                     SUMMARY                     ::
         :::::::::::::::::::::::::::::::::::::::::::::::::::::
         :: total energy             -39.208090225100 Eh    ::
         :: gradient norm              0.000288546900 Eh/a0 ::
         :: HOMO-LUMO gap              3.738745224075 eV    ::
         ::.................................................::
         :: SCC energy               -39.973633218968 Eh    ::
         :: -> isotropic ES            0.002757072404 Eh    ::
         :: -> anisotropic ES          0.005668877461 Eh    ::
         :: -> anisotropic XC          0.027804946390 Eh    ::
         :: -> dispersion             -0.028052590225 Eh    ::
         :: repulsion energy           0.765652982907 Eh    ::
         :: add. restraining           0.000000000000 Eh    ::
         :: total charge              -0.000000000000 e     ::
         :::::::::::::::::::::::::::::::::::::::::::::::::::::

           -------------------------------------------------
          |                Property Printout                |
           -------------------------------------------------

    * Orbital Energies and Occupations

         #    Occupation            Energy/Eh            Energy/eV
      -------------------------------------------------------------
         1        2.0000           -0.6449785             -17.5508
       ...           ...                  ...                  ...
        25        2.0000           -0.4687915             -12.7565
        26        2.0000           -0.4631345             -12.6025
        27        2.0000           -0.4512155             -12.2782
        28        2.0000           -0.4372440             -11.8980
        29        2.0000           -0.4340248             -11.8104
        30        2.0000           -0.4244765             -11.5506
        31        2.0000           -0.4175305             -11.3616
        32        2.0000           -0.4151040             -11.2956
        33        2.0000           -0.4059403             -11.0462
        34        2.0000           -0.4020882             -10.9414
        35        2.0000           -0.4014793             -10.9248
        36        2.0000           -0.3993567             -10.8670
        37        2.0000           -0.3791368             -10.3168 (HOMO)
        38                         -0.2417405              -6.5781 (LUMO)
        39                         -0.2196274              -5.9764
        40                         -0.2192709              -5.9667
        41                         -0.2040704              -5.5530
        42                         -0.1915375              -5.2120
        43                         -0.1006862              -2.7398
        44                         -0.0714943              -1.9455
        45                          0.0967197               2.6319
        46                          0.1038997               2.8273
        47                          0.1230453               3.3482
        48                          0.1294160               3.5216
       ...                                ...                  ...
        74                          0.6935140              18.8715
      -------------------------------------------------------------
                  HL-Gap            0.1373964 Eh            3.7387 eV
             Fermi-level           -0.3104386 Eh           -8.4475 eV

     #   Z          covCN         q      C6AA      α(0)
     1   6 C        2.837    -0.094    30.356     9.029
     2   6 C        2.890    -0.022    28.550     8.760
     3   6 C        3.812    -0.063    21.695     6.630
     4   6 C        2.974     0.014    27.685     8.631
     5   6 C        2.923    -0.039    28.966     8.826
     6   6 C        2.924    -0.036    28.885     8.814
     7   6 C        2.977     0.006    27.889     8.663
     8   6 C        2.977     0.010    27.781     8.646
     9   6 C        2.925    -0.034    28.847     8.808
    10   6 C        2.918    -0.030    28.745     8.792
    11   6 C        2.920    -0.032    28.787     8.798
    12   6 C        2.918    -0.030    28.747     8.792
    13   6 C        2.925    -0.034    28.849     8.808
    14   6 C        2.924    -0.035    28.876     8.812
    15   6 C        2.923    -0.038    28.947     8.823
    16   1 H        0.926     0.036     2.505     2.475
    17   1 H        0.926     0.034     2.526     2.485
    18   1 H        0.925     0.031     2.572     2.508
    19   1 H        0.924     0.044     2.401     2.423
    20   1 H        0.924     0.044     2.393     2.419
    21   1 H        0.925     0.028     2.610     2.526
    22   1 H        0.926     0.031     2.578     2.511
    23   1 H        0.926     0.030     2.581     2.512
    24   1 H        0.926     0.028     2.608     2.525
    25   1 H        0.926     0.028     2.611     2.527
    26   1 H        0.926     0.028     2.609     2.526
    27   1 H        0.926     0.030     2.583     2.513
    28   1 H        0.926     0.031     2.575     2.510
    29   1 H        0.926     0.031     2.575     2.509

 Mol. C6AA /au·bohr⁶  :      10400.018502
 Mol. C8AA /au·bohr⁸  :     256000.873693
 Mol. α(0) /au        :        164.602141


Wiberg/Mayer (AO) data.
largest (>0.10) Wiberg bond orders for each atom

 ---------------------------------------------------------------------------
     #   Z sym  total        # sym  WBO       # sym  WBO       # sym  WBO
 ---------------------------------------------------------------------------
     1   6 C    3.989 --     2 C    1.977    17 H    0.976    16 H    0.975
     2   6 C    3.989 --     1 C    1.977     3 C    1.009    18 H    0.967
     3   6 C    3.997 --     2 C    1.009     4 C    0.996    20 H    0.967
                            19 H    0.960
     4   6 C    3.983 --     5 C    1.410    15 C    1.402     3 C    0.996
                             7 C    0.102
     5   6 C    3.991 --     6 C    1.451     4 C    1.410    21 H    0.969
                            14 C    0.105
     6   6 C    3.991 --     5 C    1.451     7 C    1.390    22 H    0.969
                            15 C    0.107
     7   6 C    3.988 --     6 C    1.390    14 C    1.383     8 C    1.047
                             4 C    0.102
     8   6 C    3.989 --     9 C    1.389    13 C    1.389     7 C    1.047
                            11 C    0.106
     9   6 C    3.991 --    10 C    1.452     8 C    1.389    23 H    0.969
                            12 C    0.109
    10   6 C    3.992 --     9 C    1.452    11 C    1.435    24 H    0.971
                            13 C    0.109
    11   6 C    3.987 --    12 C    1.435    10 C    1.435    25 H    0.972
                             8 C    0.106
    12   6 C    3.992 --    13 C    1.452    11 C    1.435    26 H    0.971
                             9 C    0.109
    13   6 C    3.991 --    12 C    1.452     8 C    1.389    27 H    0.969
                            10 C    0.109
    14   6 C    3.992 --    15 C    1.461     7 C    1.383    28 H    0.968
                             5 C    0.105
    15   6 C    3.992 --    14 C    1.461     4 C    1.402    29 H    0.969
                             6 C    0.107
    16   1 H    0.999 --     1 C    0.975
    17   1 H    0.998 --     1 C    0.976
    18   1 H    0.999 --     2 C    0.967
    19   1 H    0.998 --     3 C    0.960
    20   1 H    0.997 --     3 C    0.967
    21   1 H    0.999 --     5 C    0.969
    22   1 H    0.999 --     6 C    0.969
    23   1 H    0.999 --     9 C    0.969
    24   1 H    0.999 --    10 C    0.971
    25   1 H    0.999 --    11 C    0.972
    26   1 H    0.999 --    12 C    0.971
    27   1 H    0.999 --    13 C    0.969
    28   1 H    0.999 --    14 C    0.968
    29   1 H    0.999 --    15 C    0.969
 ---------------------------------------------------------------------------

Topologies differ in total number of bonds
Writing topology from bond orders to xtbtopo.mol

molecular dipole:
                 x           y           z       tot (Debye)
 q only:       -0.099       0.048       0.085
   full:       -0.089       0.033       0.084       0.322
molecular quadrupole (traceless):
                xx          xy          yy          xz          yz          zz
 q only:        0.698      -0.847      -1.379      -0.958      -0.425       0.681
  q+dip:        2.521      -2.232      -5.681      -0.271      -2.563       3.160
   full:        0.856      -1.228      -2.491      -0.751      -1.172       1.635

           -------------------------------------------------
          |                Geometry Summary                 |
           -------------------------------------------------

      molecular mass/u    :      194.2722090
   center of mass at/Å    :        0.2665762      -0.0045713       0.0547345
  moments of inertia/u·Å² :        0.2355306E+03   0.1994705E+04   0.2144490E+04
rotational constants/cm⁻¹ :        0.7157300E-01   0.8451192E-02   0.7860904E-02

 * 27 selected distances

     #   Z          #   Z                                           value/Å
     1   6 C        2   6 C                                       1.3191362
     4   6 C        5   6 C                                       1.3880284
     5   6 C        6   6 C                                       1.3821493
     6   6 C        7   6 C                                       1.3920579
     8   6 C        9   6 C                                       1.3929958
     9   6 C       10   6 C                                       1.3824452
    10   6 C       11   6 C                                       1.3847424
    11   6 C       12   6 C                                       1.3847181
     8   6 C       13   6 C                                       1.3929971
    12   6 C       13   6 C                                       1.3824200
     7   6 C       14   6 C                                       1.3933319 (max)
     4   6 C       15   6 C                                       1.3896990
    14   6 C       15   6 C                                       1.3806423
     1   6 C       16   1 H                                       1.0781987
     1   6 C       17   1 H                                       1.0768290 (min)
     2   6 C       18   1 H                                       1.0824594
     3   6 C       19   1 H                                       1.0933500
     3   6 C       20   1 H                                       1.0920350
     5   6 C       21   1 H                                       1.0812531
     6   6 C       22   1 H                                       1.0804651
     9   6 C       23   1 H                                       1.0804618
    10   6 C       24   1 H                                       1.0805310
    11   6 C       25   1 H                                       1.0801682
    12   6 C       26   1 H                                       1.0805333
    13   6 C       27   1 H                                       1.0804477
    14   6 C       28   1 H                                       1.0804035
    15   6 C       29   1 H                                       1.0807719

 * 2 distinct bonds (by element types)

   Z      Z             #   av. dist./Å        max./Å        min./Å
   1 H    6 C          14     1.0819934     1.0933500     1.0768290
   6 C    6 C          13     1.3819511     1.3933319     1.3191362


optimized geometry written to: xtbopt.xyz


           -------------------------------------------------
          | TOTAL ENERGY              -39.208090225100 Eh   |
          | GRADIENT NORM               0.000288546900 Eh/α |
          | HOMO-LUMO GAP               3.738745224075 eV   |
           -------------------------------------------------

------------------------------------------------------------------------
 * finished run on 2022/03/17 at 02:19:27.342     
------------------------------------------------------------------------
 total:
 * wall-time:     0 d,  0 h,  0 min,  3.940 sec
 *  cpu-time:     0 d,  0 h,  2 min,  5.799 sec
 * ratio c/w:    31.928 speedup
 SCF:
 * wall-time:     0 d,  0 h,  0 min,  0.246 sec
 *  cpu-time:     0 d,  0 h,  0 min,  7.341 sec
 * ratio c/w:    29.791 speedup
 ANC optimizer:
 * wall-time:     0 d,  0 h,  0 min,  3.551 sec
 *  cpu-time:     0 d,  0 h,  1 min, 54.220 sec
 * ratio c/w:    32.166 speedup

